{
  "schema_version": 1,
  "candidate_commit": "23d0ef2965305cd99c2692e16a658f96163ea6e0",
  "candidate_tree": "1f0c1b26ab9a1dd337e300d88233380b69192b9a",
  "selected_engine": "docxodus",
  "docxodus_commit": "b1457bbd78b14177e3e71c739911f1772a6b1b22",
  "adeu_commit": "8a8b103849a3173c07638040c33282731d1af92e",
  "gate_report_sha256": "947a283fd1ae4df59c8c20cc9047140d000f1328354294e6f7c4655fce1bb5d4",
  "required_capabilities": [
    "stable_anchors",
    "atomic_batch",
    "comments",
    "tracked_changes",
    "structured_compare",
    "ordered_merge",
    "safe_preview"
  ],
  "required_adeu_capabilities": [
    "safe_revision",
    "author_company_cleanup",
    "rsid_cleanup",
    "custom_xml_cleanup",
    "transactional_report"
  ]
}
